{"handoff":{"allowReplayableHandoff":false,"authorizedKeyIds":["sha256:d016df3d83373617c06b5e1d6359caa06eeba8b3af2c7077234f109f2194516c"],"minimumSignatures":1,"requireExpectedArtifacts":true,"requireExpectedHead":true,"requireExpectedManifest":true,"requireNonce":false,"requireRecipient":false},"keys":{"sha256:47dea58ea00fae9417ee19d76755bfef690899021132effb04fe1f9e4f0c8059":{"label":"insecure demo-only normalize key","publicKey":"MCowBQYDK2VwAyEAgTl3Dqh9F19Wo1Rmw0x+zMuNipG07jeiXfYPW4/Js5Q=","type":"ed25519"},"sha256:8cef065b7af83669150b7d32704d3d3e75c3e9aee0d4f6740544c68e81b377aa":{"label":"insecure demo-only public key","publicKey":"MCowBQYDK2VwAyEA7UkoxijRwsbq6QM4kFmVYSlZJzpcY/k2NsFGFKyHN9E=","type":"ed25519"},"sha256:d016df3d83373617c06b5e1d6359caa06eeba8b3af2c7077234f109f2194516c":{"label":"insecure demo-only handoff key","publicKey":"MCowBQYDK2VwAyEAypOsFwUYcHHWe4PH/w7+gQjo7EUwV113JoeTM9vavnw=","type":"ed25519"},"sha256:fd110d301d2f077de1414b8f99f441b1403fab207b2052fbd2c065e4ee8e7dc2":{"label":"insecure demo-only origin key","publicKey":"MCowBQYDK2VwAyEAiojj3XQJ8ZX9UtstPLpdcspnCb8dlBIb83SIAbQPb1w=","type":"ed25519"}},"limits":{"maxAggregateArtifactBytes":53687091200,"maxArtifactBytesPerFile":10737418240,"maxArtifactValidationBytes":104857600,"maxBundleFiles":10000,"maxDiagnostics":10000,"maxJsonDepth":128,"maxJsonExponentMagnitude":10000,"maxJsonNumberChars":1024,"maxMetadataBytes":104857600,"maxNdjsonLineBytes":1048576,"maxProfileEvaluations":10000,"maxRegexLength":4096,"maxReportBytes":67108864,"maxReportRecords":20000,"maxSchemaBytes":2097152,"maxSchemaEvaluationDepth":256,"maxSchemaOperations":10000000,"maxSchemaResources":256,"maxSignaturesTotal":10000,"maxSnapshotBytes":53687091200,"profileEvaluationTimeoutSeconds":5,"profileWorkerMemoryBytes":536870912},"requiredProfiles":[{"closureDigest":{"sha256":"57eec614be9b2141ad536f486ff4400b514d79b8b1cc9642a839cf1a39b10794"},"digest":{"sha256":"68169d043c628fda5435cbd7845b02ea3e0d850b7a509c0b35fd304463fffacb"},"id":"https://schemas.example.internal/makoto/customer-public-v1.schema.json","mediaType":"application/json","scope":"eachMatchingFinalArtifact","subjectName":"customers.public.json","target":"artifact"}],"rules":[{"authorizedKeyIds":["sha256:47dea58ea00fae9417ee19d76755bfef690899021132effb04fe1f9e4f0c8059"],"id":"urn:makoto:demo:rule:normalize","minimumSignatures":1,"operationTypes":["urn:makoto:demo:operation:normalize"],"predicateTypes":["https://usemakoto.dev/predicate/v0.2/transform"]},{"authorizedKeyIds":["sha256:fd110d301d2f077de1414b8f99f441b1403fab207b2052fbd2c065e4ee8e7dc2"],"id":"urn:makoto:demo:rule:origin","minimumSignatures":1,"predicateTypes":["https://usemakoto.dev/predicate/v0.2/origin"],"sourceKinds":["urn:makoto:demo:source:synthetic-file"],"sourceUris":["urn:makoto:demo:v0.2:source:customers-raw"]},{"authorizedKeyIds":["sha256:8cef065b7af83669150b7d32704d3d3e75c3e9aee0d4f6740544c68e81b377aa"],"id":"urn:makoto:demo:rule:public-safe","minimumSignatures":1,"operationTypes":["urn:makoto:demo:operation:public-safe"],"predicateTypes":["https://usemakoto.dev/predicate/v0.2/transform"],"profileConstraints":[{"closureDigest":{"sha256":"8c13490145ccdfe6958163ef0c578afb57da07772c2071932f8a4d98870e776e"},"digest":{"sha256":"31934d2cf8fa7b5af2f8e4cf591d96278c4f59ddb6bb190afccb93701244f9eb"},"id":"https://schemas.example.internal/makoto/public-transform-metadata-v1.schema.json","target":"predicate"}]}],"version":"0.2"}
